{
  "schema_version": "creative-generation-receipt-v1",
  "request_hash": "sha256:c6c86e0b11e1c778f0d674282135c36d804b5a6dfcc4e9faa85bf7d01f4ec29a",
  "request_id": "d4-lencois-p5-atardecer-cierre.es.instagram-carousel-p5.v1",
  "design_ref": "design:d4-lencois-p5-atardecer-cierre:v1",
  "runtime": "native",
  "provider_profile": "codex-images",
  "model_snapshot": "gpt-image-2-2026-04-21",
  "created_at": "2026-07-24T16:48:58.000Z",
  "assets": [
    {
      "asset_id": "d4-lencois-p5-atardecer-cierre.es.instagram-carousel-p5.v1.a1",
      "path": ".mamw/creative/assets/c6c86e0b11e1c778f0d674282135c36d804b5a6dfcc4e9faa85bf7d01f4ec29a/asset-1.png",
      "checksum": "sha256:2f803ccdba90140784068d64b0bf966bf44281ab5462c8eafe3613322722e39d",
      "bytes": 2702841,
      "width": 1024,
      "height": 1536,
      "attempt": 1,
      "status": "succeeded"
    }
  ],
  "batch": {
    "requested": 1,
    "succeeded": 1,
    "failed": 0,
    "partial": false,
    "reused": false
  },
  "guards": {
    "max_images_per_run": 5,
    "max_bytes_per_asset": 8388608,
    "oversize_rejected": []
  }
}
